epoch_id,epoch_name,epoch_description,epoch_type,person_id,start_year_ah,end_year_ah,period_length,start_year_calculation,start_year_offset,start_year_reference_id,end_year_calculation,end_year_reference_id,period_length_reference_id,epoch_notes
Babylonian_Captivity,Babylonian Captivity,"But because our fathers had provoked the God of heaven to wrath, He gave them into the hand of Nebuchadnezzar king of Babylon, the Chaldean, who destroyed this temple and deported the people to Babylon. (Ezra 5:12) 
For thus says the LORD, 'When seventy years have been completed for Babylon, I will visit you and fulfill My good word to you, to bring you back to this place. (Jeremiah 29:10)",Captivity,,3376,3446,70,The year the seventy-year exile (Babylonian captivity) began is the year the Temple was destroyed = 3376,,JER 29:10,The year the Babylonian captivity ended was the year the captivity began (3376) + its duration (70) = 3446,JER 29:10,,"START:[Shulman date p83]
[Ussher date p104]
END:[Shulman date p83 and p143]
[Ussher date p128]"
Obadiah_prophesies,Obadiah prophesies,"On the day that you stood aloof, On the day that strangers carried off his wealth, And foreigners entered his gate And cast lots for Jerusalem — You too were as one of them. (OBA 1:11)
Obadiah's time as prophet ends",Prophet,Obadiah_12,3377,3378,1,The estimated year Obadiah's time as prophet begins is the year after Jerusalem fell to Nebuzaradan = 3377,1,OBA 1:11,The estimated year Obadiah's time as prophet ends is the year after it began = 3378,,,"START:[Ussher date p108]
END:"
Reign_of_Evil-merodach,The reign of Evil-merodach,Evil-merodach reigned after Nebuchadnezzar for 23 years: 560-538 BCE.,Reign,Evil-merodach_1,3402,3404,2,The year Evil-merodach's reign began is the year Jehoiachin's exile began (3365) + 37 years = 3402,37,JER 52:31,The year Evil-merodach's reign ended is the year his reign began (3402) + the length of his reign (2 years) = 3404,,,"START:[Shulman date p143]
[Ussher date p110]
END:*EXTRA-BIBLICAL SOURCES:
- Berossus, a Hellenistic-era Babylonian priest and historian, is cited in later works (e.g., by Josephus and Eusebius) stating that Evil-Merodach reigned for two years before being assassinated by his brother-in-law, Neriglissar. His account, preserved in fragments, describes Evil-Merodach’s rule as ""lawless and outrageous,"" leading to his overthrow after a short reign. This aligns with the two-year timeframe.
- Abydenus, another ancient historian, is referenced in the McClintock and Strong Biblical Cyclopedia as assigning Evil-Merodach a reign of two years. His works, though surviving only in fragments, corroborate Berossus’ account of the brief rule ending with Neriglissar’s usurpation.
- The Canon of Ptolemy, a chronological list of kings, records Evil-Merodach (under the name Ilvoradam or similar) as reigning for two years, from 562 to 560 BCE. This astronomical and historical document is considered a reliable source for Babylonian chronology.
- Approximately 30 cuneiform contract tablets dated to Evil-Merodach’s reign have been discovered, covering a period of about two years and five months (562–560 BCE). These tablets, used for economic transactions, provide direct evidence of his rule’s duration, as they cease after August 560 BCE, when Neriglissar’s documents appear.
- The Uruk King List, a cuneiform document, records the reigns of Babylonian kings. While it does not provide detailed narratives, it confirms Evil-Merodach’s reign as brief, consistent with the two-year period noted in other sources.
[Shulman date p143]
[Ussher date p111]"
Reign_of_Cyrus,The reign of Cyrus,Cyrus reigned after Darius for 3 years: 534-531 BCE.,Reign,Cyrus_1,3403,3432,29,The year Cyrus' reign over Persia began (according to extra-biblical sources) is 559 BCE which is 27 years after the destruction of the Temple in 586 (3376 AH + 27) = 3403,27,,The year Cyrus's reign over Persia ended is the year his reign over Persia began (3403) + the length of his reign (29) = 3432 (530 BCE),,,
Reign_of_Belshazzar,The reign of Belshazzar,"Daniel 5
 
 Belshazzar reigned after Evil-merodach for 3 years: 538-535 BCE.",Reign,Belshazzar_1,3406,3423,17,The year Belshazzar's reign began (according to extra-biblical sources) is 5 about years after Evil-merodach's reign ended (3404 + 5) = 3409,5,,The year Belshazzar's reign ended is the year Cyrus' reign began = 3423,,,"START:*EXTRA-BIBLICAL SOURCE:
The Nabonidus Chronicle, a Babylonian cuneiform text, documents the reign of Nabonidus, Belshazzar’s father, from 556 to 539 BCE. It notes that Nabonidus entrusted the kingship to Belshazzar in his third year (ca. 553 BCE) while Nabonidus was in Tema (Arabia). This suggests Belshazzar acted as co-regent or ruler in Babylon from around 553 BCE until the fall of Babylon in 539 BCE, implying a period of about 14 years. 
[Shulman date p143]
[Ussher date p113]
END:*EXTRA-BIBLICAL SOURCES:
- The Nabonidus Chronicle, a Babylonian cuneiform text, documents the reign of Nabonidus, Belshazzar’s father, from 556 to 539 BCE. It notes that Nabonidus entrusted the kingship to Belshazzar in his third year (ca. 553 BCE) while Nabonidus was in Tema (Arabia). This suggests Belshazzar acted as co-regent or ruler in Babylon from around 553 BCE until the fall of Babylon in 539 BCE, implying a period of about 14 years. The chronicle does not explicitly state the duration but provides key chronological markers.
- The Verse Account of Nabonidus (Cuneiform Text, 6th Century BCE), a propagandistic cuneiform text, likely composed after the Persian conquest, describes Nabonidus’ absence from Babylon and his delegation of authority to his son (presumably Belshazzar). It aligns with the Nabonidus Chronicle, indicating Belshazzar’s rule began around Nabonidus’ third year (553 BCE) and continued until 539 BCE, supporting a roughly 14-year period of influence.
- Numerous cuneiform tablets from Babylon, dated to the reign of Nabonidus, mention Belshazzar in roles of authority, such as overseeing transactions or military matters. These tablets span from around 553 BCE (Nabonidus’ third year) to 539 BCE, suggesting Belshazzar’s active rule or co-regency during this period. While they do not explicitly state a reign length, the consistent references over these years imply about 14 years of prominence.
- Herodotus, in his Histories (Book 1), does not directly name Belshazzar but refers to a Babylonian king (possibly Belshazzar or Nabonidus) during the fall of Babylon in 539 BCE. He does not provide a reign length, but his account aligns with the timeline of Babylonian rule ending in 539 BCE, consistent with Belshazzar’s final year as co-regent.
- In his Cyropaedia, Xenophon describes the fall of Babylon and mentions a young king ruling at the time, likely Belshazzar. While he does not specify the length of the reign, his narrative supports the timeline of 539 BCE as the end of Belshazzar’s rule, corroborating other sources that place Belshazzar in power during Nabonidus’ later years.
- Berossus, as cited by later authors like Josephus, describes the final years of Babylonian rule and mentions Belshazzar (under the name ""Nabonnedus’ son"") as ruling when Babylon fell to Cyrus in 539 BCE. While Berossus does not explicitly state the duration of Belshazzar’s rule, his account implies a shorter period of authority under Nabonidus, consistent with the co-regency starting around 553 BCE.
[Shulman date p143]
[Ussher date p116]"
